<?xml version="1.0" encoding="UTF-8"?>
<dataroot xmlns:od="urn:schemas-microsoft-com:officedata" xmlns:xsi="http://www.w3.org/2001/XMLSchema-instance"  xsi:noNamespaceSchemaLocation="effect_bonus_value_commodity_junction.xsd" generated="2010-03-11T17:31:20">
<effect_bonus_value_commodity_junction>
<effect>commodity_prod_coffee</effect>
<bonus_value_id>production</bonus_value_id>
<commodity>res_coffee</commodity>
<s_ColLineage>kNOq8QIAAACQ06rxAgAAAJDTqvECAAAA
</s_ColLineage>
<s_Generation>0</s_Generation>
<s_GUID>{C8F9E727-6173-4AC2-B996-2D12E5011B68}</s_GUID>
<s_Lineage>kNOq8QIAAAAAAAAAAAAAAA==
</s_Lineage>
</effect_bonus_value_commodity_junction>
<effect_bonus_value_commodity_junction>
<effect>commodity_prod_cotton</effect>
<bonus_value_id>production</bonus_value_id>
<commodity>res_cotton</commodity>
<s_ColLineage>kNOq8QIAAACQ06rxAgAAAJDTqvECAAAA
</s_ColLineage>
<s_Generation>0</s_Generation>
<s_GUID>{52A0E76F-06F7-4198-99C3-7800C4369927}</s_GUID>
<s_Lineage>kNOq8QIAAAAAAAAAAAAAAA==
</s_Lineage>
</effect_bonus_value_commodity_junction>
<effect_bonus_value_commodity_junction>
<effect>commodity_prod_furs</effect>
<bonus_value_id>production</bonus_value_id>
<commodity>res_furs</commodity>
<s_ColLineage>kNOq8QIAAACQ06rxAgAAAJDTqvECAAAA
</s_ColLineage>
<s_Generation>0</s_Generation>
<s_GUID>{8171E5D6-ED3B-4102-83EB-5A193CA632BC}</s_GUID>
<s_Lineage>kNOq8QIAAAAAAAAAAAAAAA==
</s_Lineage>
</effect_bonus_value_commodity_junction>
<effect_bonus_value_commodity_junction>
<effect>commodity_prod_spices</effect>
<bonus_value_id>production</bonus_value_id>
<commodity>res_spices</commodity>
<s_ColLineage>kNOq8QIAAACQ06rxAgAAAJDTqvECAAAA
</s_ColLineage>
<s_Generation>0</s_Generation>
<s_GUID>{45594A4D-B2A1-4C42-BB6B-3134E5228B8D}</s_GUID>
<s_Lineage>kNOq8QIAAAAAAAAAAAAAAA==
</s_Lineage>
</effect_bonus_value_commodity_junction>
<effect_bonus_value_commodity_junction>
<effect>commodity_prod_sugar</effect>
<bonus_value_id>production</bonus_value_id>
<commodity>res_sugar</commodity>
<s_ColLineage>kNOq8QIAAACQ06rxAgAAAJDTqvECAAAA
</s_ColLineage>
<s_Generation>0</s_Generation>
<s_GUID>{C5709BF9-A419-460F-AD16-4761706AD9F5}</s_GUID>
<s_Lineage>kNOq8QIAAAAAAAAAAAAAAA==
</s_Lineage>
</effect_bonus_value_commodity_junction>
<effect_bonus_value_commodity_junction>
<effect>commodity_prod_tea</effect>
<bonus_value_id>production</bonus_value_id>
<commodity>res_tea</commodity>
<s_ColLineage>kNOq8QIAAACQ06rxAgAAAJDTqvECAAAA
</s_ColLineage>
<s_Generation>0</s_Generation>
<s_GUID>{D825F4EF-59DD-41F7-80C8-1C9126F2814B}</s_GUID>
<s_Lineage>kNOq8QIAAAAAAAAAAAAAAA==
</s_Lineage>
</effect_bonus_value_commodity_junction>
<effect_bonus_value_commodity_junction>
<effect>commodity_prod_tobacco</effect>
<bonus_value_id>production</bonus_value_id>
<commodity>res_tobacco</commodity>
<s_ColLineage>kNOq8QIAAACQ06rxAgAAAJDTqvECAAAA
</s_ColLineage>
<s_Generation>0</s_Generation>
<s_GUID>{FA969520-FAFE-4243-9AF7-106338466D1C}</s_GUID>
<s_Lineage>kNOq8QIAAAAAAAAAAAAAAA==
</s_Lineage>
</effect_bonus_value_commodity_junction>
</dataroot>
